{
  "schema_version": "1.0",
  "room_id": "room_a",
  "captured_at": "2026-07-16T06:30:05Z",
  "width": 32,
  "height": 24,
  "values": [
    0,
    0.0323,
    0.0645,
    0.0968,
    0.129,
    0.1613,
    0.1935,
    0.2258,
    0.2581,
    0.2903,
    0.3226,
    0.3548,
    0.3871,
    0.4194,
    0.4516,
    0.4839,
    0.5161,
    0.5484,
    0.5806,
    0.6129,
    0.6452,
    0.6774,
    0.7097,
    0.7419,
    0.7742,
    0.8065,
    0.8387,
    0.871,
    0.9032,
    0.9355,
    0.9677,
    1,
    0,
    0.0323,
    0.0645,
    0.0968,
    0.129,
    0.1613,
    0.1935,
    0.2258,
    0.2581,
    0.2903,
    0.3226,
    0.3548,
    0.3871,
    0.4194,
    0.4516,
    0.4839,
    0.5161,
    0.5484,
    0.5806,
    0.6129,
    0.6452,
    0.6774,
    0.7097,
    0.7419,
    0.7742,
    0.8065,
    0.8387,
    0.871,
    0.9032,
    0.9355,
    0.9677,
    1,
    0,
    0.0323,
    0.0645,
    0.0968,
    0.129,
    0.1613,
    0.1935,
    0.2258,
    0.2581,
    0.2903,
    0.3226,
    0.3548,
    0.3871,
    0.4194,
    0.4516,
    0.4839,
    0.5161,
    0.5484,
    0.5806,
    0.6129,
    0.6452,
    0.6774,
    0.7097,
    0.7419,
    0.7742,
    0.8065,
    0.8387,
    0.871,
    0.9032,
    0.9355,
    0.9677,
    1,
    0,
    0.0323,
    0.0645,
    0.0968,
    0.129,
    0.1613,
    0.1935,
    0.2258,
    0.2581,
    0.2903,
    0.3226,
    0.3548,
    0.3871,
    0.4194,
    0.4516,
    0.4839,
    0.5161,
    0.5484,
    0.5806,
    0.6129,
    0.6452,
    0.6774,
    0.7097,
    0.7419,
    0.7742,
    0.8065,
    0.8387,
    0.871,
    0.9032,
    0.9355,
    0.9677,
    1,
    0,
    0.0323,
    0.0645,
    0.0968,
    0.129,
    0.1613,
    0.1935,
    0.2258,
    0.2581,
    0.2903,
    0.3226,
    0.3548,
    0.3871,
    0.4194,
    0.4516,
    0.4839,
    0.5161,
    0.5484,
    0.5806,
    0.6129,
    0.6452,
    0.6774,
    0.7097,
    0.7419,
    0.7742,
    0.8065,
    0.8387,
    0.871,
    0.9032,
    0.9355,
    0.9677,
    1,
    0,
    0.0323,
    0.0645,
    0.0968,
    0.129,
    0.1613,
    0.1935,
    0.2258,
    0.2581,
    0.2903,
    0.3226,
    0.3548,
    0.3871,
    0.4194,
    0.4516,
    0.4839,
    0.5161,
    0.5484,
    0.5806,
    0.6129,
    0.6452,
    0.6774,
    0.7097,
    0.7419,
    0.7742,
    0.8065,
    0.8387,
    0.871,
    0.9032,
    0.9355,
    0.9677,
    1,
    0,
    0.0323,
    0.0645,
    0.0968,
    0.129,
    0.1613,
    0.1935,
    0.2258,
    0.2581,
    0.2903,
    0.3226,
    0.3548,
    0.3871,
    0.4194,
    0.4516,
    0.4839,
    0.5161,
    0.5484,
    0.5806,
    0.6129,
    0.6452,
    0.6774,
    0.7097,
    0.7419,
    0.7742,
    0.8065,
    0.8387,
    0.871,
    0.9032,
    0.9355,
    0.9677,
    1,
    0,
    0.0323,
    0.0645,
    0.0968,
    0.129,
    0.1613,
    0.1935,
    0.2258,
    0.2581,
    0.2903,
    0.3226,
    0.3548,
    0.3871,
    0.4194,
    0.4516,
    0.4839,
    0.5161,
    0.5484,
    0.5806,
    0.6129,
    0.6452,
    0.6774,
    0.7097,
    0.7419,
    0.7742,
    0.8065,
    0.8387,
    0.871,
    0.9032,
    0.9355,
    0.9677,
    1,
    0,
    0.0323,
    0.0645,
    0.0968,
    0.129,
    0.1613,
    0.1935,
    0.2258,
    0.2581,
    0.2903,
    0.3226,
    0.3548,
    0.3871,
    0.4194,
    0.4516,
    0.4839,
    0.5161,
    0.5484,
    0.5806,
    0.6129,
    0.6452,
    0.6774,
    0.7097,
    0.7419,
    0.7742,
    0.8065,
    0.8387,
    0.871,
    0.9032,
    0.9355,
    0.9677,
    1,
    0,
    0.0323,
    0.0645,
    0.0968,
    0.129,
    0.1613,
    0.1935,
    0.2258,
    0.2581,
    0.2903,
    0.3226,
    0.3548,
    0.3871,
    0.4194,
    0.4516,
    0.4839,
    0.5161,
    0.5484,
    0.5806,
    0.6129,
    0.6452,
    0.6774,
    0.7097,
    0.7419,
    0.7742,
    0.8065,
    0.8387,
    0.871,
    0.9032,
    0.9355,
    0.9677,
    1,
    0,
    0.0323,
    0.0645,
    0.0968,
    0.129,
    0.1613,
    0.1935,
    0.2258,
    0.2581,
    0.2903,
    0.3226,
    0.3548,
    0.3871,
    0.4194,
    0.4516,
    0.4839,
    0.5161,
    0.5484,
    0.5806,
    0.6129,
    0.6452,
    0.6774,
    0.7097,
    0.7419,
    0.7742,
    0.8065,
    0.8387,
    0.871,
    0.9032,
    0.9355,
    0.9677,
    1,
    0,
    0.0323,
    0.0645,
    0.0968,
    0.129,
    0.1613,
    0.1935,
    0.2258,
    0.2581,
    0.2903,
    0.3226,
    0.3548,
    0.3871,
    0.4194,
    0.4516,
    0.4839,
    0.5161,
    0.5484,
    0.5806,
    0.6129,
    0.6452,
    0.6774,
    0.7097,
    0.7419,
    0.7742,
    0.8065,
    0.8387,
    0.871,
    0.9032,
    0.9355,
    0.9677,
    1,
    0,
    0.0323,
    0.0645,
    0.0968,
    0.129,
    0.1613,
    0.1935,
    0.2258,
    0.2581,
    0.2903,
    0.3226,
    0.3548,
    0.3871,
    0.4194,
    0.4516,
    0.4839,
    0.5161,
    0.5484,
    0.5806,
    0.6129,
    0.6452,
    0.6774,
    0.7097,
    0.7419,
    0.7742,
    0.8065,
    0.8387,
    0.871,
    0.9032,
    0.9355,
    0.9677,
    1,
    0,
    0.0323,
    0.0645,
    0.0968,
    0.129,
    0.1613,
    0.1935,
    0.2258,
    0.2581,
    0.2903,
    0.3226,
    0.3548,
    0.3871,
    0.4194,
    0.4516,
    0.4839,
    0.5161,
    0.5484,
    0.5806,
    0.6129,
    0.6452,
    0.6774,
    0.7097,
    0.7419,
    0.7742,
    0.8065,
    0.8387,
    0.871,
    0.9032,
    0.9355,
    0.9677,
    1,
    0,
    0.0323,
    0.0645,
    0.0968,
    0.129,
    0.1613,
    0.1935,
    0.2258,
    0.2581,
    0.2903,
    0.3226,
    0.3548,
    0.3871,
    0.4194,
    0.4516,
    0.4839,
    0.5161,
    0.5484,
    0.5806,
    0.6129,
    0.6452,
    0.6774,
    0.7097,
    0.7419,
    0.7742,
    0.8065,
    0.8387,
    0.871,
    0.9032,
    0.9355,
    0.9677,
    1,
    0,
    0.0323,
    0.0645,
    0.0968,
    0.129,
    0.1613,
    0.1935,
    0.2258,
    0.2581,
    0.2903,
    0.3226,
    0.3548,
    0.3871,
    0.4194,
    0.4516,
    0.4839,
    0.5161,
    0.5484,
    0.5806,
    0.6129,
    0.6452,
    0.6774,
    0.7097,
    0.7419,
    0.7742,
    0.8065,
    0.8387,
    0.871,
    0.9032,
    0.9355,
    0.9677,
    1,
    0,
    0.0323,
    0.0645,
    0.0968,
    0.129,
    0.1613,
    0.1935,
    0.2258,
    0.2581,
    0.2903,
    0.3226,
    0.3548,
    0.3871,
    0.4194,
    0.4516,
    0.4839,
    0.5161,
    0.5484,
    0.5806,
    0.6129,
    0.6452,
    0.6774,
    0.7097,
    0.7419,
    0.7742,
    0.8065,
    0.8387,
    0.871,
    0.9032,
    0.9355,
    0.9677,
    1,
    0,
    0.0323,
    0.0645,
    0.0968,
    0.129,
    0.1613,
    0.1935,
    0.2258,
    0.2581,
    0.2903,
    0.3226,
    0.3548,
    0.3871,
    0.4194,
    0.4516,
    0.4839,
    0.5161,
    0.5484,
    0.5806,
    0.6129,
    0.6452,
    0.6774,
    0.7097,
    0.7419,
    0.7742,
    0.8065,
    0.8387,
    0.871,
    0.9032,
    0.9355,
    0.9677,
    1,
    0,
    0.0323,
    0.0645,
    0.0968,
    0.129,
    0.1613,
    0.1935,
    0.2258,
    0.2581,
    0.2903,
    0.3226,
    0.3548,
    0.3871,
    0.4194,
    0.4516,
    0.4839,
    0.5161,
    0.5484,
    0.5806,
    0.6129,
    0.6452,
    0.6774,
    0.7097,
    0.7419,
    0.7742,
    0.8065,
    0.8387,
    0.871,
    0.9032,
    0.9355,
    0.9677,
    1,
    0,
    0.0323,
    0.0645,
    0.0968,
    0.129,
    0.1613,
    0.1935,
    0.2258,
    0.2581,
    0.2903,
    0.3226,
    0.3548,
    0.3871,
    0.4194,
    0.4516,
    0.4839,
    0.5161,
    0.5484,
    0.5806,
    0.6129,
    0.6452,
    0.6774,
    0.7097,
    0.7419,
    0.7742,
    0.8065,
    0.8387,
    0.871,
    0.9032,
    0.9355,
    0.9677,
    1,
    0,
    0.0323,
    0.0645,
    0.0968,
    0.129,
    0.1613,
    0.1935,
    0.2258,
    0.2581,
    0.2903,
    0.3226,
    0.3548,
    0.3871,
    0.4194,
    0.4516,
    0.4839,
    0.5161,
    0.5484,
    0.5806,
    0.6129,
    0.6452,
    0.6774,
    0.7097,
    0.7419,
    0.7742,
    0.8065,
    0.8387,
    0.871,
    0.9032,
    0.9355,
    0.9677,
    1,
    0,
    0.0323,
    0.0645,
    0.0968,
    0.129,
    0.1613,
    0.1935,
    0.2258,
    0.2581,
    0.2903,
    0.3226,
    0.3548,
    0.3871,
    0.4194,
    0.4516,
    0.4839,
    0.5161,
    0.5484,
    0.5806,
    0.6129,
    0.6452,
    0.6774,
    0.7097,
    0.7419,
    0.7742,
    0.8065,
    0.8387,
    0.871,
    0.9032,
    0.9355,
    0.9677,
    1,
    0,
    0.0323,
    0.0645,
    0.0968,
    0.129,
    0.1613,
    0.1935,
    0.2258,
    0.2581,
    0.2903,
    0.3226,
    0.3548,
    0.3871,
    0.4194,
    0.4516,
    0.4839,
    0.5161,
    0.5484,
    0.5806,
    0.6129,
    0.6452,
    0.6774,
    0.7097,
    0.7419,
    0.7742,
    0.8065,
    0.8387,
    0.871,
    0.9032,
    0.9355,
    0.9677,
    1,
    0,
    0.0323,
    0.0645,
    0.0968,
    0.129,
    0.1613,
    0.1935,
    0.2258,
    0.2581,
    0.2903,
    0.3226,
    0.3548,
    0.3871,
    0.4194,
    0.4516,
    0.4839,
    0.5161,
    0.5484,
    0.5806,
    0.6129,
    0.6452,
    0.6774,
    0.7097,
    0.7419,
    0.7742,
    0.8065,
    0.8387,
    0.871,
    0.9032,
    0.9355,
    0.9677,
    1
  ],
  "normalization": "window_min_max_clipped",
  "expires_in_seconds": 30
}
